{
  "schema": "discover/v0",
  "title": "Sound R1CS Gadget Optimization",
  "summary": "Prove the same BN254 R1CS statements with fewer constraints, with every optimized gadget's exported matrices checked against the intended witness relation by an exact-algebra checker, against pinned arkworks baselines.",
  "domains": [
    "cryptography",
    "formal-methods"
  ],
  "maintainers": [
    {
      "name": "Doug Colkitt",
      "github": "Mister-Meeseeks"
    }
  ],
  "canonical_repo": "https://github.com/discoveryathome/zk-gadgets",
  "entry": {
    "agents": "AGENTS.md",
    "project": "DISCOVERY.md"
  },
  "frontier": "discover/frontier.json",
  "catalog": "discover/catalog.json",
  "priority_log": "discover/priority-log.md",
  "ledger": "discover/ledger.md",
  "packages": "research/*/",
  "overlap": {
    "sources": [
      "packages",
      "ledger"
    ]
  },
  "session": {
    "default_minutes": 60,
    "orient_fraction": 0.2,
    "verify_fraction": 0.25
  },
  "permissions": {
    "post_messages": true,
    "open_prs": true,
    "maintainer_only": [
      "change-frontier",
      "accept-results",
      "submit-upstream",
      "license",
      "merge",
      "close-others-prs"
    ]
  },
  "verification_profile": "exact-certificate",
  "license": "MIT",
  "credit": {
    "policy": "Credit named contributions and independent reviews in CONTRIBUTORS.md; cite upstream sources. No automatic authorship claims.",
    "kinds": [
      "contributors-file",
      "citation"
    ]
  },
  "review": {
    "per_week": "surge",
    "note": "Maintainer: @Mister-Meeseeks, from 2026-10-21. Results are author-checked; independent review of the relation checker (scripts/verify.py) and of each new candidate's relation check, and comparisons against tuned baselines, are wanted before acceptance."
  },
  "requirements": {
    "ram_gb": 4,
    "disk_gb": 1,
    "note": "Python 3.9+ for saved-artifact verification; Rust/Cargo for full synthesis and Groth16 replay. No GPU. Initial build needs network."
  },
  "hubs": [
    {
      "hub": "discoveryathome/discover",
      "list": true,
      "push": []
    }
  ],
  "coordination": {
    "transport": "github-discussions",
    "threads": {
      "start": 1,
      "handoffs": 2,
      "proposals": 3,
      "feedback": 4
    }
  }
}
